{
  "artifact_sha256": "87c8d03c0549525fa47813b2d8b2437a0386320e84327be0e05bb9e90887e284",
  "coverage_levels": [
    1.0,
    0.95,
    0.9,
    0.8,
    0.7,
    0.5
  ],
  "dependence_models": [
    "naive_sum",
    "correlated_shrinkage",
    "document_level"
  ],
  "evidence_pipeline": [
    "raw detector score",
    "probability calibration on an independent calibration set",
    "likelihood-ratio calibration using declared cohort prevalence",
    "evidence model (naive, correlated, or document-level)",
    "declared prior",
    "posterior",
    "uncertainty / conformal set",
    "decision or abstain"
  ],
  "mixture_rates": [
    0.0,
    0.1,
    0.25,
    0.5,
    0.75,
    0.9,
    1.0
  ],
  "outputs": {
    "ai_generation": "P(the majority or entirety of the content was generated by an AI system).",
    "ai_participation": "P(AI generated or substantially modified the content). This is not interchangeable with P(AI-generated).",
    "source_family": "Conditional similarity among supported generator families plus an explicit unknown/open-set score."
  },
  "power": {
    "accuracy_mde": 0.05,
    "accuracy_required_n": 3140,
    "alpha": 0.05,
    "note": "The existing two-proportion gate remains the admission rule for neural-tier comparisons. Calibration and transport claims require the same group-disjoint protocol even when the neural gate fails.",
    "target_power": 0.8
  },
  "primary_metrics": {
    "attribution": [
      "macro_f1",
      "unknown_rejection_auroc"
    ],
    "low_fpr": [
      "tpr_at_0.1fpr",
      "tpr_at_1fpr",
      "tpr_at_5fpr"
    ],
    "not_primary": [
      "accuracy at 0.5"
    ],
    "probability_quality": [
      "brier",
      "ece",
      "calibration_slope",
      "calibration_intercept"
    ],
    "ranking": [
      "auroc",
      "auprc"
    ],
    "robustness": [
      "worst_group",
      "transport_matrix"
    ],
    "selective": [
      "selective_risk",
      "coverage"
    ]
  },
  "priors": {
    "default_prior_odds": 1.0,
    "prevalence_grid": [
      0.001,
      0.005,
      0.01,
      0.05,
      0.1,
      0.25,
      0.5,
      0.75
    ],
    "rule": "Detector evidence (LR) and posterior probability are not the same quantity. Every reported posterior names its prior."
  },
  "provenance_levels": {
    "P0": "No provenance.",
    "P1": "Self-declared model identity.",
    "P2": "Authenticated provider metadata.",
    "P3": "Cryptographically signed generation receipt (e.g. verified C2PA).",
    "P4": "Independently verifiable execution (hash-pinned run, Merkle commitment, optional OpenTimestamps)."
  },
  "registered_utc": "2026-08-13T00:00:00Z",
  "research_questions": [
    {
      "id": "RQ1",
      "name": "Calibration",
      "primary_metrics": [
        "brier",
        "ece",
        "calibration_slope",
        "calibration_intercept",
        "reliability_bins"
      ],
      "question": "When Panoptes reports a probability of AI participation, does that probability correspond to empirical frequency under a declared population?"
    },
    {
      "id": "RQ2",
      "name": "Distribution shift",
      "primary_metrics": [
        "transport_auroc",
        "transport_brier",
        "transport_ece",
        "transport_slope",
        "worst_group"
      ],
      "question": "How much does AI-text attribution degrade when the domain, generator, prompt, time period, or editing process changes?"
    },
    {
      "id": "RQ3",
      "name": "Evidence aggregation",
      "primary_metrics": [
        "selective_risk",
        "coverage",
        "prior_sensitivity",
        "dependence_calibration"
      ],
      "question": "Does explicit calibration, Bayesian evidence aggregation, uncertainty estimation, and abstention improve trustworthiness over conventional classifier scores?"
    },
    {
      "id": "RQ4",
      "name": "Reproducibility",
      "primary_metrics": [
        "artifact_hash_match",
        "independent_delta"
      ],
      "question": "Can the full experimental claim be independently verified from cryptographically committed datasets, model artifacts, manifests, and results?"
    }
  ],
  "schema": "panoptes-research-protocol-v1",
  "split_rules": {
    "grouping": "Splits are disjoint on prompt/group, and additionally on author and source/story when those fields exist.",
    "hard_rule": "Train, calibration, and test are separate. Never fit or tune the calibration layer on the final test set.",
    "holdout_fractions": {
      "calibration": 0.2,
      "test": 0.2,
      "train": 0.6
    },
    "leakage": "Official publisher splits are audited and never used when they leak groups.",
    "nested_grouped_cv": "Default when n_groups < 30. Outer folds are untouched test groups; inner splits separate train from calibration.",
    "unseen_generator": "Source-family attribution trains on known families and tests held-out families as unknown-source rejection."
  },
  "stylometry_hypotheses": "bench/hypotheses.json remains the H1-H6 stylometry battery. Those tests are not the primary scientific claims of this protocol.",
  "tasks": {
    "ai_assisted": "A human authored the content but AI substantially generated or modified portions.",
    "ai_generated": "The majority or entirety of the content was generated by an AI system.",
    "human_only": "No AI generation or substantive AI rewriting.",
    "unknown": "Available evidence is insufficient for a supported attribution."
  },
  "thesis": "AI-text attribution is a measurement problem: the evidential meaning of a detector score depends on the generating population, prevalence, domain, manipulation history, provenance, and calibration cohort. Panoptes measures that evidential strength and its failure modes rather than ranking another detector.",
  "title": "Panoptes measurement protocol v1",
  "what_not_to_claim": [
    "Panoptes is a highly accurate AI detector.",
    "AI text is universally identifiable.",
    "ECE discounts or mathematically rescales a reported posterior.",
    "Segment residuals that fail to reject autocorrelation prove segment independence.",
    "Source-family similarity is exact model identity.",
    "A negative watermark test is evidence of human authorship."
  ]
}
